Kerma Task 4 Comprehensive Test Suite
Target: 128.130.122.73:18018
Restarting Docker containers for clean environment...
Docker containers restarted.


======================================================================
Running 40 tests...
======================================================================

[0/39]: Basic Handshake... ←: {"agent":"Bootstrap Node","type":"hello","version":"0.10.5"}
→: {"type":"hello","version":"0.10.0","agent":"Kerma-Test-Client"}
✓ PASS (4.05s)
[1/39]: GetChainTip (Initial)... ←: {"agent":"Bootstrap Node","type":"hello","version":"0.10.5"}
→: {"type":"hello","version":"0.10.0","agent":"Kerma-Test-Client"}
←: {"type":"getpeers"}
→: {"type":"peers","peers":[]}
→: {"type":"getchaintip"}
←: {"blockid":"00001e3df6febb885649646500d925bae9d4594794028c8b8d561f8467ee3403","type":"chaintip"}
✗ FAIL (12.34s)
  └─ Expected genesis 00002fa163c7dab0991544424b9fd302bb1782b185e5a3bbdf12afb758e57dee, got 00001e3df6febb885649646500d925bae9d4594794028c8b8d561f8467ee3403
[2/39]: ⚡ No Fetch: Invalid PoW... ←: {"agent":"Bootstrap Node","type":"hello","version":"0.10.5"}
→: {"type":"hello","version":"0.10.0","agent":"Kerma-Test-Client"}
←: {"type":"getpeers"}
→: {"type":"peers","peers":[]}
→: {"type":"object","object":{"type":"block","txids":[],"nonce":"ffffffffffffffffffffffffffffffffffffffffffffffffffffffffffffffff","previd":"1111111111111111111111111111111111111111111111111111111111111111","created":1671062500,"T":"0000abc000000000000000000000000000000000000000000000000000000000","miner":"test","note":"test"}}
←: {"msg":"Block does not satisfy proof-of-work equation (has an objectid of 0444f6a1f2a12f0d99faeeaf9565cb77c1e22fd44f78b1f9864f5fa3c00a4a97)!","name":"INVALID_BLOCK_POW","type":"error"}
✓ PASS (12.34s)
[3/39]: ⚡ No Fetch: Future Timestamp... ←: {"agent":"Bootstrap Node","type":"hello","version":"0.10.5"}
→: {"type":"hello","version":"0.10.0","agent":"Kerma-Test-Client"}
←: {"type":"getpeers"}
→: {"type":"peers","peers":[]}
    ⛏️  Mined! nonce=0000000000000000... (28654 iterations)
→: {"type":"object","object":{"type":"block","txids":[],"nonce":"0000000000000000000000000000000000000000000000000000000000006fed","previd":"1111111111111111111111111111111111111111111111111111111111111111","created":3376598400,"T":"0000abc000000000000000000000000000000000000000000000000000000000","miner":"test","note":"test"}}
←: {"msg":"Block object invalid: created timestamp could not be parsed!","name":"INVALID_BLOCK_TIMESTAMP","type":"error"}
✓ PASS (12.48s)
[4/39]: ⚡ No Fetch: Invalid Genesis... ←: {"agent":"Bootstrap Node","type":"hello","version":"0.10.5"}
→: {"type":"hello","version":"0.10.0","agent":"Kerma-Test-Client"}
←: {"type":"getpeers"}
→: {"type":"peers","peers":[]}
    ⛏️  Mined! nonce=0000000000000000... (87806 iterations)
→: {"type":"object","object":{"type":"block","txids":[],"nonce":"00000000000000000000000000000000000000000000000000000000000156fd","previd":null,"created":1671062401,"T":"0000abc000000000000000000000000000000000000000000000000000000000","miner":"fake","note":"test"}}
←: {"msg":"Block object invalid: previd is null but this is not the genesis block","name":"INVALID_GENESIS","type":"error"}
✓ PASS (12.74s)
[5/39]: ⚡ No Fetch: Malformed Block... ←: {"agent":"Bootstrap Node","type":"hello","version":"0.10.5"}
→: {"type":"hello","version":"0.10.0","agent":"Kerma-Test-Client"}
←: {"type":"getpeers"}
→: {"type":"peers","peers":[]}
→: {"type":"object","object":{"type":"block","txids":[],"previd":"1111111111111111111111111111111111111111111111111111111111111111","created":1671062500,"T":"0000abc000000000000000000000000000000000000000000000000000000000"}}
←: {"msg":"Block does not satisfy proof-of-work equation (has an objectid of 64246eb86eadf82310e15549b374ca3accc75a60e888a1e2d53c5335c747f348)!","name":"INVALID_BLOCK_POW","type":"error"}
✓ PASS (12.33s)
[6/39]: ⚡ No Fetch: Invalid Tx Format... ←: {"agent":"Bootstrap Node","type":"hello","version":"0.10.5"}
→: {"type":"hello","version":"0.10.0","agent":"Kerma-Test-Client"}
←: {"type":"getpeers"}
→: {"type":"peers","peers":[]}
→: {"type":"object","object":{"type":"transaction","inputs":[{"outpoint":{"txid":"aaaaaaaaaaaaaaaaaaaaaaaaaaaaaaaaaaaaaaaaaaaaaaaaaaaaaaaaaaaaaaaa","index":0},"sig":"invalid_not_hex"}],"outputs":[{"pubkey":"bbbbbbbbbbbbbbbbbbbbbbbbbbbbbbbbbbbbbbbbbbbbbbbbbbbbbbbbbbbbbbbb","value":1000}]}}
←: {"msg":"Normal transaction object invalid: Input at index 1 invalid: sig not syntactically valid!","name":"INVALID_FORMAT","type":"error"}
✓ PASS (12.34s)
[7/39]: ⚡ No Fetch: Coinbase with Inputs... ←: {"agent":"Bootstrap Node","type":"hello","version":"0.10.5"}
→: {"type":"hello","version":"0.10.0","agent":"Kerma-Test-Client"}
←: {"type":"getpeers"}
→: {"type":"peers","peers":[]}
→: {"type":"object","object":{"type":"transaction","height":1,"inputs":[{"outpoint":{"txid":"aaaaaaaaaaaaaaaaaaaaaaaaaaaaaaaaaaaaaaaaaaaaaaaaaaaaaaaaaaaaaaaa","index":0},"sig":"bbbbbbbbbbbbbbbbbbbbbbbbbbbbbbbbbbbbbbbbbbbbbbbbbbbbbbbbbbbbbbbbbbbbbbbbbbbbbbbbbbbbbbbbbbbbbbbbbbbbbbbbbbbbbbbbbbbbbbbbbbbbbbbb"}],"outputs":[{"pubkey":"cccccccccccccccccccccccccccccccccccccccccccccccccccccccccccccccc","value":50000000000000}]}}
←: {"msg":"Coinbase transaction object invalid: Additional keys present","name":"INVALID_FORMAT","type":"error"}
✓ PASS (12.33s)
[8/39]: ⚡ Fetch Only When Needed... ←: {"agent":"Bootstrap Node","type":"hello","version":"0.10.5"}
→: {"type":"hello","version":"0.10.0","agent":"Kerma-Test-Client"}
←: {"type":"getchaintip"}
    ⛏️  Mined! nonce=0000000000000000... (23961 iterations)
→: {"type":"object","object":{"type":"block","txids":[],"nonce":"0000000000000000000000000000000000000000000000000000000000005d98","previd":"1111111111111111111111111111111111111111111111111111111111111111","created":1671062500,"T":"0000abc000000000000000000000000000000000000000000000000000000000","miner":"test","note":"test"}}
←: {"objectid":"1111111111111111111111111111111111111111111111111111111111111111","type":"getobject"}
✓ PASS (8.46s)
[9/39]: ⚡ Validation Order Check... ←: {"agent":"Bootstrap Node","type":"hello","version":"0.10.5"}
→: {"type":"hello","version":"0.10.0","agent":"Kerma-Test-Client"}
←: {"type":"getpeers"}
→: {"type":"peers","peers":[]}
→: {"type":"object","object":{"type":"block","txids":["59f8e5802d7006c7f08ed39e8fc6f0fc03b69b3b8a5ea89175e897f61050407c"],"nonce":"ffffffffffffffffffffffffffffffffffffffffffffffffffffffffffffffff","previd":"1111111111111111111111111111111111111111111111111111111111111111","created":1671062500,"T":"0000abc000000000000000000000000000000000000000000000000000000000","miner":"test","note":"test"}}
←: {"msg":"Block does not satisfy proof-of-work equation (has an objectid of d86febdfd00db10912cec568f81cadeb560f966e3830d9aa46e0af10473c55c1)!","name":"INVALID_BLOCK_POW","type":"error"}
✓ PASS (12.33s)
[10/39]: 1a: Unavailable Block... ←: {"agent":"Bootstrap Node","type":"hello","version":"0.10.5"}
→: {"type":"hello","version":"0.10.0","agent":"Kerma-Test-Client"}
←: {"type":"getpeers"}
→: {"type":"peers","peers":[]}
    ⛏️  Mined! nonce=0000000000000000... (57890 iterations)
→: {"type":"object","object":{"type":"block","txids":[],"nonce":"000000000000000000000000000000000000000000000000000000000000e221","previd":"1111111111111111111111111111111111111111111111111111111111111111","created":1765546413,"T":"0000abc000000000000000000000000000000000000000000000000000000000","miner":"test","note":"test"}}
←: {"objectid":"1111111111111111111111111111111111111111111111111111111111111111","type":"getobject"}
←: {"msg":"Timeout triggered for object 0000a1b2e3f8deee2915f756b596fc86c4cbc342fbe329fccfabb26faa9f534c, did not receive {'1111111111111111111111111111111111111111111111111111111111111111'}","name":"UNFINDABLE_OBJECT","type":"error"}
✓ PASS (13.67s)
[11/39]: 1b: Non-Increasing Timestamps... ←: {"agent":"Bootstrap Node","type":"hello","version":"0.10.5"}
→: {"type":"hello","version":"0.10.0","agent":"Kerma-Test-Client"}
←: {"type":"getpeers"}
→: {"type":"peers","peers":[]}
    ⛏️  Mined! nonce=0000000000000000... (51356 iterations)
    ⛏️  Mined! nonce=0000000000000000... (1404 iterations)
    ⛏️  Mining... 100000 nonces...
    ⛏️  Mined! nonce=0000000000000000... (134857 iterations)
→: {"type":"object","object":{"type":"block","txids":[],"nonce":"0000000000000000000000000000000000000000000000000000000000020ec8","previd":"00007fe222c98f23464deb47c8fd131ca152da0ec0a9e2d3036335886b0f361e","created":1671062500,"T":"0000abc000000000000000000000000000000000000000000000000000000000","miner":"test","note":"test"}}
✗ FAIL (16.27s)
  └─ Expected INVALID_BLOCK_TIMESTAMP error but didn't receive it
[12/39]: 1c: Future Timestamp (2077)... ←: {"agent":"Bootstrap Node","type":"hello","version":"0.10.5"}
→: {"type":"hello","version":"0.10.0","agent":"Kerma-Test-Client"}
←: {"type":"getpeers"}
→: {"type":"peers","peers":[]}
    ⛏️  Mined! nonce=0000000000000000... (82312 iterations)
→: {"type":"object","object":{"type":"block","txids":[],"nonce":"0000000000000000000000000000000000000000000000000000000000014187","previd":"00002fa163c7dab0991544424b9fd302bb1782b185e5a3bbdf12afb758e57dee","created":3376598400,"T":"0000abc000000000000000000000000000000000000000000000000000000000","miner":"test","note":"test"}}
←: {"msg":"Block object invalid: created timestamp could not be parsed!","name":"INVALID_BLOCK_TIMESTAMP","type":"error"}
✓ PASS (12.75s)
[13/39]: 1d: Invalid PoW... ←: {"agent":"Bootstrap Node","type":"hello","version":"0.10.5"}
→: {"type":"hello","version":"0.10.0","agent":"Kerma-Test-Client"}
←: {"type":"getpeers"}
→: {"type":"peers","peers":[]}
→: {"type":"object","object":{"type":"block","txids":[],"nonce":"ffffffffffffffffffffffffffffffffffffffffffffffffffffffffffffffff","previd":"00002fa163c7dab0991544424b9fd302bb1782b185e5a3bbdf12afb758e57dee","created":1671062500,"T":"0000abc000000000000000000000000000000000000000000000000000000000","miner":"test","note":"test"}}
←: {"msg":"Block does not satisfy proof-of-work equation (has an objectid of 4256978daa5f5dbfa74bb63e4e132d7f6f0b8558aca82bd928002eb1b0307453)!","name":"INVALID_BLOCK_POW","type":"error"}
✓ PASS (12.33s)
[14/39]: 1e: Wrong Genesis... ←: {"agent":"Bootstrap Node","type":"hello","version":"0.10.5"}
→: {"type":"hello","version":"0.10.0","agent":"Kerma-Test-Client"}
←: {"type":"getpeers"}
→: {"type":"peers","peers":[]}
    ⛏️  Mined! nonce=0000000000000000... (72463 iterations)
→: {"type":"object","object":{"type":"block","txids":[],"nonce":"0000000000000000000000000000000000000000000000000000000000011b0e","previd":null,"created":1671062401,"T":"0000abc000000000000000000000000000000000000000000000000000000000","miner":"fake"}}
←: {"msg":"Block object invalid: previd is null but this is not the genesis block","name":"INVALID_GENESIS","type":"error"}
✓ PASS (12.68s)
[15/39]: 1f: Incorrect Coinbase Height... ←: {"agent":"Bootstrap Node","type":"hello","version":"0.10.5"}
→: {"type":"hello","version":"0.10.0","agent":"Kerma-Test-Client"}
←: {"type":"getpeers"}
→: {"type":"peers","peers":[]}
    ⛏️  Mined! nonce=0000000000000000... (91192 iterations)
→: {"type":"object","object":{"type":"block","txids":["ded7f05868b57a4a16d98b881b94b7bc23b527e4cc48ce50008f3dd17c309d18"],"nonce":"0000000000000000000000000000000000000000000000000000000000016437","previd":"00002fa163c7dab0991544424b9fd302bb1782b185e5a3bbdf12afb758e57dee","created":1671062500,"T":"0000abc000000000000000000000000000000000000000000000000000000000","miner":"test","note":"test"}}
←: {"msg":"Coinbase TX height invalid!","name":"INVALID_BLOCK_COINBASE","type":"error"}
✗ FAIL (12.84s)
  └─ Expected getobject request
[16/39]: 1g: Double Spending... ←: {"agent":"Bootstrap Node","type":"hello","version":"0.10.5"}
→: {"type":"hello","version":"0.10.0","agent":"Kerma-Test-Client"}
←: 
Receive failed: Expecting value: line 1 column 1 (char 0)
    ⛏️  Mined! nonce=0000000000000000... (14452 iterations)
    ⛏️  Mined! nonce=0000000000000000... (51593 iterations)
→: {"type":"object","object":{"type":"block","txids":["4d4dfd67bbebec2e0f0801116826166d0005ace0cb3aba7e78dbcb99da1a0e7e"],"nonce":"000000000000000000000000000000000000000000000000000000000000c988","previd":"00009a3ad39860f3b70cf603312c14450e40c699ad61a89d140a6851ffe37da1","created":1671062600,"T":"0000abc000000000000000000000000000000000000000000000000000000000","miner":"test","note":"test"}}
✗ FAIL (11.81s)
  └─ Expected INVALID_TX_OUTPOINT error but didn't receive it
[17/39]: 1h: Non-Existent Output... ←: {"agent":"Bootstrap Node","type":"hello","version":"0.10.5"}
→: {"type":"hello","version":"0.10.0","agent":"Kerma-Test-Client"}
←: {"type":"getpeers"}
→: {"type":"peers","peers":[]}
[DEBUG] Created coinbase with 1 output: b3d1bda7c7c79918bccba7d5f6be86c8a2fc24d472010f46f1a155f5fa0b82ed
[DEBUG] Created tx spending non-existent index 1: d003328dace979ad8ded49ec531679fc28e15931f2c7a5577a2a69e304cf2836
    ⛏️  Mining... 100000 nonces...
    ⛏️  Mined! nonce=0000000000000000... (140117 iterations)
    ⛏️  Mining... 100000 nonces...
    ⛏️  Mined! nonce=0000000000000000... (107778 iterations)
[DEBUG] Block1: 00001a313b16eb23947302f0f9b32c80bfb8cffdf1d801c64c2698bbe44e08ca
[DEBUG] Block2: 0000718cf7e587cea9ad194eed7509c18a1507d6f8e992785205f979709bed16
[DEBUG] Sending block2...
→: {"type":"object","object":{"type":"block","txids":["d003328dace979ad8ded49ec531679fc28e15931f2c7a5577a2a69e304cf2836"],"nonce":"000000000000000000000000000000000000000000000000000000000001a501","previd":"00001a313b16eb23947302f0f9b32c80bfb8cffdf1d801c64c2698bbe44e08ca","created":1671062600,"T":"0000abc000000000000000000000000000000000000000000000000000000000","miner":"test","note":"test"}}
[DEBUG] Iteration 1: Waiting for messages...
[DEBUG] No messages received in iteration 1
✗ FAIL (15.19s)
  └─ Expected INVALID_TX_OUTPOINT. Got 0 messages, errors: []
[18/39]: INVALID_TX_CONSERVATION... ←: {"agent":"Bootstrap Node","type":"hello","version":"0.10.5"}
→: {"type":"hello","version":"0.10.0","agent":"Kerma-Test-Client"}
←: {"type":"getpeers"}
→: {"type":"peers","peers":[]}
    ⛏️  Mined! nonce=0000000000000000... (18993 iterations)
→: {"type":"object","object":{"type":"block","txids":["b3d1bda7c7c79918bccba7d5f6be86c8a2fc24d472010f46f1a155f5fa0b82ed","ad8a8ad512c6cd6ca06cc5e671195c13e92371bc6a10f705f6ea8f37eaf54ec9"],"nonce":"0000000000000000000000000000000000000000000000000000000000004a30","previd":"00002fa163c7dab0991544424b9fd302bb1782b185e5a3bbdf12afb758e57dee","created":1671062500,"T":"0000abc000000000000000000000000000000000000000000000000000000000","miner":"test","note":"test"}}
✗ FAIL (16.45s)
  └─ Expected INVALID_TX_CONSERVATION, got: []
[19/39]: INVALID_TX_SIGNATURE... ←: {"agent":"Bootstrap Node","type":"hello","version":"0.10.5"}
→: {"type":"hello","version":"0.10.0","agent":"Kerma-Test-Client"}
←: {"type":"getpeers"}
→: {"type":"peers","peers":[]}
    ⛏️  Mined! nonce=0000000000000000... (1149 iterations)
→: {"type":"object","object":{"type":"block","txids":["b3d1bda7c7c79918bccba7d5f6be86c8a2fc24d472010f46f1a155f5fa0b82ed","c4f8ea89300824944bdcb0f186f45479a23a919f4bd17ae901de28e0a9c778f9"],"nonce":"000000000000000000000000000000000000000000000000000000000000047c","previd":"00002fa163c7dab0991544424b9fd302bb1782b185e5a3bbdf12afb758e57dee","created":1671062500,"T":"0000abc000000000000000000000000000000000000000000000000000000000","miner":"test","note":"test"}}
✗ FAIL (16.35s)
  └─ Expected INVALID_TX_SIGNATURE, got: []
[20/39]: INVALID_BLOCK_COINBASE (excessive value)... ←: {"agent":"Bootstrap Node","type":"hello","version":"0.10.5"}
→: {"type":"hello","version":"0.10.0","agent":"Kerma-Test-Client"}
←: {"type":"getpeers"}
→: {"type":"peers","peers":[]}
    ⛏️  Mined! nonce=0000000000000000... (58237 iterations)
→: {"type":"object","object":{"type":"block","txids":["40e9ec8de7b65ef8beabc30cd77445b1852a028d5e8b8ada07d637de6195dbe8"],"nonce":"000000000000000000000000000000000000000000000000000000000000e37c","previd":"00002fa163c7dab0991544424b9fd302bb1782b185e5a3bbdf12afb758e57dee","created":1671062500,"T":"0000abc000000000000000000000000000000000000000000000000000000000","miner":"test","note":"test"}}
←: {"msg":"Coinbase TX output value too big","name":"INVALID_BLOCK_COINBASE","type":"error"}
✗ FAIL (13.65s)
  └─ Expected INVALID_BLOCK_COINBASE, got: []
[21/39]: INVALID_TX_OUTPOINT (spend coinbase same block)... ←: {"agent":"Bootstrap Node","type":"hello","version":"0.10.5"}
→: {"type":"hello","version":"0.10.0","agent":"Kerma-Test-Client"}
←: {"type":"getpeers"}
→: {"type":"peers","peers":[]}
    ⛏️  Mined! nonce=0000000000000000... (14452 iterations)
→: {"type":"object","object":{"type":"block","txids":["b3d1bda7c7c79918bccba7d5f6be86c8a2fc24d472010f46f1a155f5fa0b82ed","4d4dfd67bbebec2e0f0801116826166d0005ace0cb3aba7e78dbcb99da1a0e7e"],"nonce":"0000000000000000000000000000000000000000000000000000000000003873","previd":"00002fa163c7dab0991544424b9fd302bb1782b185e5a3bbdf12afb758e57dee","created":1671062500,"T":"0000abc000000000000000000000000000000000000000000000000000000000","miner":"test","note":"test"}}
←: {"msg":"Coinbase TX spent in same block!","name":"INVALID_TX_OUTPOINT","type":"error"}
✗ FAIL (13.42s)
  └─ Expected INVALID_TX_OUTPOINT, got: []
[22/39]: INVALID_BLOCK_COINBASE (multiple)... ←: {"agent":"Bootstrap Node","type":"hello","version":"0.10.5"}
→: {"type":"hello","version":"0.10.0","agent":"Kerma-Test-Client"}
←: {"type":"getpeers"}
→: {"type":"peers","peers":[]}
    ⛏️  Mining... 100000 nonces...
    ⛏️  Mining... 200000 nonces...
    ⛏️  Mined! nonce=0000000000000000... (290982 iterations)
→: {"type":"object","object":{"type":"block","txids":["376c54f2e420c8c5c6ebe5562e7e6e6c3805336452757386feee6d990757ff6a","75f72f15c8c54b6184a5ad53ad3ac638b72abcc69867376fcd0c284f0b0ad760"],"nonce":"00000000000000000000000000000000000000000000000000000000000470a5","previd":"00002fa163c7dab0991544424b9fd302bb1782b185e5a3bbdf12afb758e57dee","created":1671062500,"T":"0000abc000000000000000000000000000000000000000000000000000000000","miner":"test","note":"test"}}
←: {"msg":"Coinbase TX 75f72f15c8c54b6184a5ad53ad3ac638b72abcc69867376fcd0c284f0b0ad760 not at index 0!","name":"INVALID_BLOCK_COINBASE","type":"error"}
✗ FAIL (14.03s)
  └─ Expected INVALID_BLOCK_COINBASE, got: []
[23/39]: INVALID_BLOCK_COINBASE (not first)... ←: {"agent":"Bootstrap Node","type":"hello","version":"0.10.5"}
→: {"type":"hello","version":"0.10.0","agent":"Kerma-Test-Client"}
←: {"type":"getpeers"}
→: {"type":"peers","peers":[]}
    ⛏️  Mined! nonce=0000000000000000... (24509 iterations)
→: {"type":"object","object":{"type":"block","txids":["696d5b330fdf294931c9ccaec5555cb77c6d482d431833d50794728ac887ce93","b3d1bda7c7c79918bccba7d5f6be86c8a2fc24d472010f46f1a155f5fa0b82ed"],"nonce":"0000000000000000000000000000000000000000000000000000000000005fbc","previd":"00002fa163c7dab0991544424b9fd302bb1782b185e5a3bbdf12afb758e57dee","created":1671062500,"T":"0000abc000000000000000000000000000000000000000000000000000000000","miner":"test","note":"test"}}
←: {"objectid":"696d5b330fdf294931c9ccaec5555cb77c6d482d431833d50794728ac887ce93","type":"getobject"}
←: {"msg":"Timeout triggered for object 000003b614710293559fadd6f82dd13126d5c5c3426825a063f8807cc92dcd01, did not receive {'696d5b330fdf294931c9ccaec5555cb77c6d482d431833d50794728ac887ce93'}","name":"UNFINDABLE_OBJECT","type":"error"}
→: {"type":"object","object":{"type":"transaction","inputs":[{"outpoint":{"txid":"aaaaaaaaaaaaaaaaaaaaaaaaaaaaaaaaaaaaaaaaaaaaaaaaaaaaaaaaaaaaaaaa","index":0},"sig":"bbbbbbbbbbbbbbbbbbbbbbbbbbbbbbbbbbbbbbbbbbbbbbbbbbbbbbbbbbbbbbbbbbbbbbbbbbbbbbbbbbbbbbbbbbbbbbbbbbbbbbbbbbbbbbbbbbbbbbbbbbbbbbbb"}],"outputs":[{"pubkey":"af06a3e3291714e4f356c19c9b15cd1951ec6e6662aa77be07547f289383341d","value":1000}]}}
←: {"objectid":"aaaaaaaaaaaaaaaaaaaaaaaaaaaaaaaaaaaaaaaaaaaaaaaaaaaaaaaaaaaaaaaa","type":"getobject"}
←: {"msg":"Timeout triggered for object 696d5b330fdf294931c9ccaec5555cb77c6d482d431833d50794728ac887ce93, did not receive ['aaaaaaaaaaaaaaaaaaaaaaaaaaaaaaaaaaaaaaaaaaaaaaaaaaaaaaaaaaaaaaaa']","name":"UNFINDABLE_OBJECT","type":"error"}
✗ FAIL (21.59s)
  └─ Expected INVALID_BLOCK_COINBASE, got: [{'objectid': 'aaaaaaaaaaaaaaaaaaaaaaaaaaaaaaaaaaaaaaaaaaaaaaaaaaaaaaaaaaaaaaaa', 'type': 'getobject'}, {'msg': "Timeout triggered for object 696d5b330fdf294931c9ccaec5555cb77c6d482d431833d50794728ac887ce93, did not receive ['aaaaaaaaaaaaaaaaaaaaaaaaaaaaaaaaaaaaaaaaaaaaaaaaaaaaaaaaaaaaaaaa']", 'name': 'UNFINDABLE_OBJECT', 'type': 'error'}]
[24/39]: INVALID_TX_CONSERVATION (self double-spend)... ←: {"agent":"Bootstrap Node","type":"hello","version":"0.10.5"}
→: {"type":"hello","version":"0.10.0","agent":"Kerma-Test-Client"}
←: {"type":"getpeers"}
→: {"type":"peers","peers":[]}
    ⛏️  Mined! nonce=0000000000000000... (15217 iterations)
→: {"type":"object","object":{"type":"block","txids":["b3d1bda7c7c79918bccba7d5f6be86c8a2fc24d472010f46f1a155f5fa0b82ed","98a39d1ef90ee37f70a75841ac5df1ce6c0fc723f07fc67c24e1d8eac2693e8a"],"nonce":"0000000000000000000000000000000000000000000000000000000000003b70","previd":"00002fa163c7dab0991544424b9fd302bb1782b185e5a3bbdf12afb758e57dee","created":1671062500,"T":"0000abc000000000000000000000000000000000000000000000000000000000","miner":"test","note":"test"}}
✗ FAIL (16.43s)
  └─ Expected INVALID_TX_CONSERVATION, got: []
[25/39]: INVALID_FORMAT (block as tx)... ←: {"agent":"Bootstrap Node","type":"hello","version":"0.10.5"}
→: {"type":"hello","version":"0.10.0","agent":"Kerma-Test-Client"}
←: {"type":"getpeers"}
→: {"type":"peers","peers":[]}
    ⛏️  Mining... 100000 nonces...
    ⛏️  Mined! nonce=0000000000000000... (174720 iterations)
→: {"type":"object","object":{"type":"block","txids":["fcb6680309f5df94e3241b3426fa85677ef23d9f3197086f21f677a4a58e3917"],"nonce":"000000000000000000000000000000000000000000000000000000000002aa7f","previd":"00002fa163c7dab0991544424b9fd302bb1782b185e5a3bbdf12afb758e57dee","created":1671062500,"T":"0000abc000000000000000000000000000000000000000000000000000000000","miner":"test","note":"test"}}
✗ FAIL (17.30s)
  └─ Expected INVALID_FORMAT, got: []
[26/39]: ChainTip INVALID_FORMAT... ←: {"agent":"Bootstrap Node","type":"hello","version":"0.10.5"}
→: {"type":"hello","version":"0.10.0","agent":"Kerma-Test-Client"}
←: {"type":"getpeers"}
→: {"type":"peers","peers":[]}
→: {"type":"chaintip","blockid":"696d5b330fdf294931c9ccaec5555cb77c6d482d431833d50794728ac887ce93"}
←: {"msg":"Proposed chaintip does not satisfy proof-of-work equation (has an objectid of 696d5b330fdf294931c9ccaec5555cb77c6d482d431833d50794728ac887ce93)!","name":"INVALID_BLOCK_POW","type":"error"}
✗ FAIL (12.64s)
  └─ Expected INVALID_FORMAT
[27/39]: ChainTip INVALID_BLOCK_POW... ←: {"agent":"Bootstrap Node","type":"hello","version":"0.10.5"}
→: {"type":"hello","version":"0.10.0","agent":"Kerma-Test-Client"}
←: {"type":"getpeers"}
→: {"type":"peers","peers":[]}
→: {"type":"chaintip","blockid":"ffffffffffffffffffffffffffffffffffffffffffffffffffffffffffffffff"}
←: {"msg":"Proposed chaintip does not satisfy proof-of-work equation (has an objectid of ffffffffffffffffffffffffffffffffffffffffffffffffffffffffffffffff)!","name":"INVALID_BLOCK_POW","type":"error"}
✓ PASS (12.63s)
[28/39]: Happy Path: Valid Chain... ←: {"agent":"Bootstrap Node","type":"hello","version":"0.10.5"}
→: {"type":"hello","version":"0.10.0","agent":"Kerma-Test-Client"}
←: {"type":"getpeers"}
→: {"type":"peers","peers":[]}
  Mining valid blocks...
    ⛏️  Mining... 100000 nonces...
    ⛏️  Mined! nonce=0000000000000000... (140117 iterations)
    ⛏️  Mined! nonce=0000000000000000... (85522 iterations)
  Sending blocks to node...
→: {"type":"object","object":{"type":"block","txids":["d7c01da0005c18f7594700cbcb8f5f7ac75e6816989adf313fe8b478d6a44e02"],"nonce":"0000000000000000000000000000000000000000000000000000000000014e11","previd":"00001a313b16eb23947302f0f9b32c80bfb8cffdf1d801c64c2698bbe44e08ca","created":1671062600,"T":"0000abc000000000000000000000000000000000000000000000000000000000","miner":"test","note":"test"}}
  Waiting for block validation...
  Checking chain tip...
→: {"type":"getchaintip"}
←: {"blockid":"00001e3df6febb885649646500d925bae9d4594794028c8b8d561f8467ee3403","type":"chaintip"}
✗ FAIL (20.88s)
  └─ Unexpected tip: 00001e3df6febb885649646500d925bae9d4594794028c8b8d561f8467ee3403
[29/39]: Longest Chain Selection... ←: {"agent":"Bootstrap Node","type":"hello","version":"0.10.5"}
→: {"type":"hello","version":"0.10.0","agent":"Kerma-Test-Client"}
←: {"type":"getpeers"}
→: {"type":"peers","peers":[]}
  Mining chains A (length 1) and B (length 2)...
    ⛏️  Mined! nonce=0000000000000000... (70001 iterations)
    ⛏️  Mining... 100000 nonces...
    ⛏️  Mining... 200000 nonces...
    ⛏️  Mined! nonce=0000000000000000... (265402 iterations)
    ⛏️  Mined! nonce=0000000000000000... (83797 iterations)
  Sending chain A first...
→: {"type":"object","object":{"type":"block","txids":["b3d1bda7c7c79918bccba7d5f6be86c8a2fc24d472010f46f1a155f5fa0b82ed"],"nonce":"0000000000000000000000000000000000000000000000000000000000011170","previd":"00002fa163c7dab0991544424b9fd302bb1782b185e5a3bbdf12afb758e57dee","created":1671062500,"T":"0000abc000000000000000000000000000000000000000000000000000000000","miner":"test","note":"chain_a"}}
→: {"type":"getchaintip"}
←: {"blockid":"00001e3df6febb885649646500d925bae9d4594794028c8b8d561f8467ee3403","type":"chaintip"}
  After chain A: tip=00001e3df6febb88...
  Sending longer chain B...
→: {"type":"object","object":{"type":"block","txids":["d7c01da0005c18f7594700cbcb8f5f7ac75e6816989adf313fe8b478d6a44e02"],"nonce":"0000000000000000000000000000000000000000000000000000000000014754","previd":"00007af401c11264d350dff48a1ca0cbc09e8e3b564994cc5c84c67eac6b7124","created":1671062600,"T":"0000abc000000000000000000000000000000000000000000000000000000000","miner":"test","note":"chain_b2"}}
→: {"type":"getchaintip"}
←: {"blockid":"00001e3df6febb885649646500d925bae9d4594794028c8b8d561f8467ee3403","type":"chaintip"}
  After chain B: tip=00001e3df6febb88...
✗ FAIL (30.63s)
  └─ Unexpected tip: 00001e3df6febb885649646500d925bae9d4594794028c8b8d561f8467ee3403
[30/39]: Invalid Longer Chain Rejected... ←: {"agent":"Bootstrap Node","type":"hello","version":"0.10.5"}
→: {"type":"hello","version":"0.10.0","agent":"Kerma-Test-Client"}
←: {"type":"getpeers"}
→: {"type":"peers","peers":[]}
  Mining valid chain and creating invalid longer chain...
    ⛏️  Mined! nonce=0000000000000000... (18425 iterations)
    ⛏️  Mined! nonce=0000000000000000... (21235 iterations)
  Sending valid chain first...
→: {"type":"object","object":{"type":"block","txids":["b3d1bda7c7c79918bccba7d5f6be86c8a2fc24d472010f46f1a155f5fa0b82ed"],"nonce":"00000000000000000000000000000000000000000000000000000000000047f8","previd":"00002fa163c7dab0991544424b9fd302bb1782b185e5a3bbdf12afb758e57dee","created":1671062500,"T":"0000abc000000000000000000000000000000000000000000000000000000000","miner":"test","note":"valid"}}
→: {"type":"getchaintip"}
←: {"blockid":"00001e3df6febb885649646500d925bae9d4594794028c8b8d561f8467ee3403","type":"chaintip"}
  After valid chain: tip=00001e3df6febb88...
  Sending invalid longer chain...
→: {"type":"object","object":{"type":"block","txids":["d7c01da0005c18f7594700cbcb8f5f7ac75e6816989adf313fe8b478d6a44e02"],"nonce":"00000000000000000000000000000000000000000000000000000000000052f2","previd":"f616b8b5b131aa943e5afca436fb66e70b248c1aab951d11f3f42313a7611052","created":1671062600,"T":"0000abc000000000000000000000000000000000000000000000000000000000","miner":"test","note":"invalid_ancestry"}}
←: {"objectid":"f616b8b5b131aa943e5afca436fb66e70b248c1aab951d11f3f42313a7611052","type":"getobject"}
→: {"type":"object","object":{"type":"block","txids":[],"nonce":"ffffffffffffffffffffffffffffffffffffffffffffffffffffffffffffffff","previd":"00002fa163c7dab0991544424b9fd302bb1782b185e5a3bbdf12afb758e57dee","created":1671062501,"T":"0000abc000000000000000000000000000000000000000000000000000000000","miner":"test","note":"test"}}
←: {"msg":"Block does not satisfy proof-of-work equation (has an objectid of f616b8b5b131aa943e5afca436fb66e70b248c1aab951d11f3f42313a7611052)!","name":"INVALID_BLOCK_POW","type":"error"}
→: {"type":"getchaintip"}
  After invalid chain: tip=none...
✗ FAIL (32.06s)
  └─ Unexpected tip: None
[31/39]: IHaveObject Broadcast... ←: {"agent":"Bootstrap Node","type":"hello","version":"0.10.5"}
→: {"type":"hello","version":"0.10.0","agent":"Kerma-Test-Client"}
←: {"type":"getpeers"}
→: {"type":"peers","peers":[]}
  Mining valid block for ihaveobject test...
    ⛏️  Mined! nonce=0000000000000000... (44268 iterations)
→: {"type":"object","object":{"type":"block","txids":["b3d1bda7c7c79918bccba7d5f6be86c8a2fc24d472010f46f1a155f5fa0b82ed"],"nonce":"000000000000000000000000000000000000000000000000000000000000aceb","previd":"00002fa163c7dab0991544424b9fd302bb1782b185e5a3bbdf12afb758e57dee","created":1671062500,"T":"0000abc000000000000000000000000000000000000000000000000000000000","miner":"test","note":"ihave_test"}}
✗ FAIL (15.37s)
  └─ No ihaveobject received (expected for block or coinbase)
[32/39]: Peers Message Validation... ←: {"agent":"Bootstrap Node","type":"hello","version":"0.10.5"}
→: {"type":"hello","version":"0.10.0","agent":"Kerma-Test-Client"}
←: {"type":"getpeers"}
→: {"type":"peers","peers":[]}
→: {"type":"peers","peers":["node1.example.com:18018","192.168.1.100:18018","10.0.0.5:19000"]}
→: {"type":"getpeers"}
←: {"peers":["41.66.68.47:59739","46.125.249.30:64968","41.66.69.19:63569","212.227.173.184:39584","212.227.173.184:52180","81.223.98.222:40143","41.66.69.19:60086","41.66.69.19:60603","212.227.173.184:33642","41.66.69.19:62740","41.66.69.19:63807","212.227.173.184:57550","41.66.69.19:62058","212.227.173.184:60934","109.60.126.229:56523","41.66.68.47:61236","128.131.215.206:60750","212.227.173.184:57410","41.66.69.19:63406","41.66.69.19:63865","41.66.68.47:60934","212.227.173.184:37860","212.227.173.184:39320","41.66.69.19:61571","41.66.69.19:61489","41.66.68.47:64706","212.227.173.184:57766","212.227.173.184:53726","212.227.173.184:42490","41.66.69.19:60368"],"type":"peers"}
✓ PASS (16.84s)
[33/39]: Invalid Peers Format... ←: {"agent":"Bootstrap Node","type":"hello","version":"0.10.5"}
→: {"type":"hello","version":"0.10.0","agent":"Kerma-Test-Client"}
←: {"type":"getpeers"}
→: {"type":"peers","peers":[]}
→: {"type":"peers","peers":["node.example.com"]}
←: {"msg":"No port given","name":"INVALID_FORMAT","type":"error"}
✓ PASS (12.34s)
[34/39]: GetPeers On Connect... ←: {"agent":"Bootstrap Node","type":"hello","version":"0.10.5"}
→: {"type":"hello","version":"0.10.0","agent":"Kerma-Test-Client"}
←: {"type":"getpeers"}
→: {"type":"peers","peers":[]}
✓ PASS (8.04s)
[35/39]: GetChainTip On Connect... ←: {"agent":"Bootstrap Node","type":"hello","version":"0.10.5"}
→: {"type":"hello","version":"0.10.0","agent":"Kerma-Test-Client"}
←: {"type":"getpeers"}
→: {"type":"peers","peers":[]}
✗ FAIL (10.03s)
  └─ Expected getchaintip after getpeers, got: None
[36/39]: Unknown Object Response... ←: {"agent":"Bootstrap Node","type":"hello","version":"0.10.5"}
→: {"type":"hello","version":"0.10.0","agent":"Kerma-Test-Client"}
←: {"type":"getpeers"}
→: {"type":"peers","peers":[]}
→: {"type":"getobject","objectid":"9999999999999999999999999999999999999999999999999999999999999999"}
←: {"msg":"Object 9999999999999999999999999999999999999999999999999999999999999999 not known","name":"UNKNOWN_OBJECT","type":"error"}
✓ PASS (12.33s)
[37/39]: Object Broadcast After Validation... ←: {"agent":"Bootstrap Node","type":"hello","version":"0.10.5"}
→: {"type":"hello","version":"0.10.0","agent":"Kerma-Test-Client"}
←: 
Receive failed: Expecting value: line 1 column 1 (char 0)
  Mining block for broadcast test...
    ⛏️  Mined! nonce=0000000000000000... (25611 iterations)
→: {"type":"object","object":{"type":"block","txids":["b3d1bda7c7c79918bccba7d5f6be86c8a2fc24d472010f46f1a155f5fa0b82ed"],"nonce":"000000000000000000000000000000000000000000000000000000000000640a","previd":"00002fa163c7dab0991544424b9fd302bb1782b185e5a3bbdf12afb758e57dee","created":1671062500,"T":"0000abc000000000000000000000000000000000000000000000000000000000","miner":"test","note":"broadcast_test"}}
→: {"type":"getobject","objectid":"00005614db11707385b607cea4dfbdd3c110894ce2d32682386bcd482178eac5"}
←: {"object":{"T":"0000abc000000000000000000000000000000000000000000000000000000000","created":1671062500,"miner":"test","nonce":"000000000000000000000000000000000000000000000000000000000000640a","note":"broadcast_test","previd":"00002fa163c7dab0991544424b9fd302bb1782b185e5a3bbdf12afb758e57dee","txids":["b3d1bda7c7c79918bccba7d5f6be86c8a2fc24d472010f46f1a155f5fa0b82ed"],"type":"block"},"type":"object"}
✓ PASS (13.78s)
[38/39]: Multiple ChainTip Updates... ←: {"agent":"Bootstrap Node","type":"hello","version":"0.10.5"}
→: {"type":"hello","version":"0.10.0","agent":"Kerma-Test-Client"}
←: 
Receive failed: Expecting value: line 1 column 1 (char 0)
  Mining 3 blocks for chaintip update test...
    ⛏️  Mined! nonce=0000000000000000... (91365 iterations)
    ⛏️  Mining... 100000 nonces...
    ⛏️  Mining... 200000 nonces...
    ⛏️  Mining... 300000 nonces...
    ⛏️  Mined! nonce=0000000000000000... (337366 iterations)
    ⛏️  Mining... 100000 nonces...
    ⛏️  Mined! nonce=0000000000000000... (181717 iterations)
→: {"type":"object","object":{"type":"block","txids":["b3d1bda7c7c79918bccba7d5f6be86c8a2fc24d472010f46f1a155f5fa0b82ed"],"nonce":"00000000000000000000000000000000000000000000000000000000000164e4","previd":"00002fa163c7dab0991544424b9fd302bb1782b185e5a3bbdf12afb758e57dee","created":1671062500,"T":"0000abc000000000000000000000000000000000000000000000000000000000","miner":"test","note":"tip1"}}
→: {"type":"getchaintip"}
←: {"blockid":"00001e3df6febb885649646500d925bae9d4594794028c8b8d561f8467ee3403","type":"chaintip"}
→: {"type":"object","object":{"type":"block","txids":["d7c01da0005c18f7594700cbcb8f5f7ac75e6816989adf313fe8b478d6a44e02"],"nonce":"00000000000000000000000000000000000000000000000000000000000525d5","previd":"0000492e85f1578eca661096773e7152a7a7d9968d2ccc22ec34059b78cbd2e6","created":1671062600,"T":"0000abc000000000000000000000000000000000000000000000000000000000","miner":"test","note":"tip2"}}
→: {"type":"getchaintip"}
←: {"blockid":"00001e3df6febb885649646500d925bae9d4594794028c8b8d561f8467ee3403","type":"chaintip"}
→: {"type":"object","object":{"type":"block","txids":["fffa179cd99b7e0171fd226ee8f25e7c7604a472509926337a9cdf3411f8de5f"],"nonce":"000000000000000000000000000000000000000000000000000000000002c5d4","previd":"000043b854ecf0188e8acb22a2e8d3182e2878571475f61f3152546c0d46dbbb","created":1671062700,"T":"0000abc000000000000000000000000000000000000000000000000000000000","miner":"test","note":"tip3"}}
→: {"type":"getchaintip"}
←: {"blockid":"00001e3df6febb885649646500d925bae9d4594794028c8b8d561f8467ee3403","type":"chaintip"}
✗ FAIL (34.42s)
  └─ Tip didn't update to block 3 (got 00001e3df6febb885649646500d925bae9d4594794028c8b8d561f8467ee3403)
[39/39]: Forked Chains Selection... ←: {"agent":"Bootstrap Node","type":"hello","version":"0.10.5"}
→: {"type":"hello","version":"0.10.0","agent":"Kerma-Test-Client"}
←: 
Receive failed: Expecting value: line 1 column 1 (char 0)
  Mining forked chains...
    ⛏️  Mined! nonce=0000000000000000... (52932 iterations)
    ⛏️  Mining... 100000 nonces...
    ⛏️  Mining... 200000 nonces...
    ⛏️  Mined! nonce=0000000000000000... (206780 iterations)
    ⛏️  Mined! nonce=0000000000000000... (35124 iterations)
    ⛏️  Mined! nonce=0000000000000000... (89722 iterations)
    ⛏️  Mining... 100000 nonces...
    ⛏️  Mining... 200000 nonces...
    ⛏️  Mining... 300000 nonces...
    ⛏️  Mined! nonce=0000000000000000... (336557 iterations)
  Sending fork B (shorter) first...
→: {"type":"object","object":{"type":"block","txids":["d7c01da0005c18f7594700cbcb8f5f7ac75e6816989adf313fe8b478d6a44e02"],"nonce":"00000000000000000000000000000000000000000000000000000000000522ac","previd":"000065c369e3b54e8cebf1853d43694b92294a5ffe5c07fa784283feb5a8fbe1","created":1671062601,"T":"0000abc000000000000000000000000000000000000000000000000000000000","miner":"test","note":"fork_b2"}}
  Sending fork A (longer)...
→: {"type":"object","object":{"type":"block","txids":["fffa179cd99b7e0171fd226ee8f25e7c7604a472509926337a9cdf3411f8de5f"],"nonce":"0000000000000000000000000000000000000000000000000000000000008933","previd":"00004b956e21b50340baa006d57bf1562b49f2d91ff4702ee47efada1f502579","created":1671062700,"T":"0000abc000000000000000000000000000000000000000000000000000000000","miner":"test","note":"fork_a3"}}
→: {"type":"getchaintip"}
←: {"blockid":"00001e3df6febb885649646500d925bae9d4594794028c8b8d561f8467ee3403","type":"chaintip"}
✗ FAIL (22.53s)
  └─ Unexpected tip: 00001e3df6febb885649646500d925bae9d4594794028c8b8d561f8467ee3403

======================================================================
Test Summary: 19/40 passed
======================================================================

Failed tests:
  • [1] getchaintip_initial: Expected genesis 00002fa163c7dab0991544424b9fd302bb1782b185e5a3bbdf12afb758e57dee, got 00001e3df6febb885649646500d925bae9d4594794028c8b8d561f8467ee3403
  • [11] non_increasing_timestamps: Expected INVALID_BLOCK_TIMESTAMP error but didn't receive it
  • [15] incorrect_coinbase_height: Expected getobject request
  • [16] double_spending: Expected INVALID_TX_OUTPOINT error but didn't receive it
  • [17] nonexistent_output: Expected INVALID_TX_OUTPOINT. Got 0 messages, errors: []
  • [18] invalid_tx_conservation: Expected INVALID_TX_CONSERVATION, got: []
  • [19] invalid_tx_signature: Expected INVALID_TX_SIGNATURE, got: []
  • [20] coinbase_excessive_value: Expected INVALID_BLOCK_COINBASE, got: []
  • [21] spending_coinbase_same_block: Expected INVALID_TX_OUTPOINT, got: []
  • [22] multiple_coinbase: Expected INVALID_BLOCK_COINBASE, got: []
  • [23] coinbase_not_first: Expected INVALID_BLOCK_COINBASE, got: [{'objectid': 'aaaaaaaaaaaaaaaaaaaaaaaaaaaaaaaaaaaaaaaaaaaaaaaaaaaaaaaaaaaaaaaa', 'type': 'getobject'}, {'msg': "Timeout triggered for object 696d5b330fdf294931c9ccaec5555cb77c6d482d431833d50794728ac887ce93, did not receive ['aaaaaaaaaaaaaaaaaaaaaaaaaaaaaaaaaaaaaaaaaaaaaaaaaaaaaaaaaaaaaaaa']", 'name': 'UNFINDABLE_OBJECT', 'type': 'error'}]
  • [24] self_double_spend: Expected INVALID_TX_CONSERVATION, got: []
  • [25] invalid_format_block_as_tx: Expected INVALID_FORMAT, got: []
  • [26] chaintip_invalid_format: Expected INVALID_FORMAT
  • [28] happy_path_valid_chain: Unexpected tip: 00001e3df6febb885649646500d925bae9d4594794028c8b8d561f8467ee3403
  • [29] longest_chain_selection: Unexpected tip: 00001e3df6febb885649646500d925bae9d4594794028c8b8d561f8467ee3403
  • [30] invalid_longer_chain_rejected: Unexpected tip: None
  • [31] ihaveobject_broadcast: No ihaveobject received (expected for block or coinbase)
  • [35] getchaintip_on_connect: Expected getchaintip after getpeers, got: None
  • [38] multiple_chaintip_updates: Tip didn't update to block 3 (got 00001e3df6febb885649646500d925bae9d4594794028c8b8d561f8467ee3403)
  • [39] forked_chains: Unexpected tip: 00001e3df6febb885649646500d925bae9d4594794028c8b8d561f8467ee3403

